{
  "batchId": "editorial-batch:20260930-priority-completion",
  "familyIds": [
    "expression:acknowledge-effort-gokurousama",
    "expression:acknowledge-support-okagesamade",
    "expression:welcome-someone-back",
    "expression:attribute-beneficial-result-okagede",
    "expression:formal-apology-aisumimasen",
    "expression:formal-existence-gozaimasu",
    "expression:react-sugee",
    "expression:preface-sensitive-question-shitsureidesuga",
    "expression:acknowledge-received-help-osewa",
    "expression:threaten-retaliation-oboetero",
    "expression:express-liking-kiniiru",
    "expression:request-refraining-goenryo",
    "expression:grassroots-kusanone",
    "expression:new-year-greeting",
    "expression:honorific-view-goran",
    "expression:report-hearsay-soudesu",
    "expression:preface-disagreement-okotobadesuga",
    "expression:acknowledge-inconvenience",
    "expression:ask-whats-wrong",
    "expression:ask-repetition",
    "expression:unseen-work-ennoshitanomai",
    "expression:invite-to-look-goran",
    "expression:formal-regarding-nitsukimashite",
    "expression:make-request-onegaishimasu",
    "expression:offer-congratulations",
    "expression:urge-care"
  ],
  "candidateIds": [
    "candidate:jmdict:1005030",
    "candidate:jmdict:2859985",
    "candidate:jmdict:1002260",
    "candidate:jmdict:1270220",
    "candidate:jmdict:2847268",
    "candidate:jmdict:2847269",
    "candidate:jmdict:2005860",
    "candidate:jmdict:1008930",
    "candidate:jmdict:1270210",
    "candidate:jmdict:1221740",
    "candidate:jmdict:2038000",
    "candidate:jmdict:1612690",
    "candidate:jmdict:2872401",
    "candidate:jmdict:1401920",
    "candidate:jmdict:2217040",
    "candidate:jmdict:1005100",
    "candidate:jmdict:1270770",
    "candidate:jmdict:1001720",
    "candidate:jmdict:1001730",
    "candidate:jmdict:2221720",
    "candidate:jmdict:1532270",
    "candidate:jmdict:1001540",
    "candidate:jmdict:1002410",
    "candidate:jmdict:2847195",
    "candidate:jmdict:2864550",
    "candidate:jmdict:2722660",
    "candidate:jmdict:2837492",
    "candidate:jmdict:2211850",
    "candidate:jmdict:2542470",
    "candidate:jmdict:2834649",
    "candidate:jmdict:1221870",
    "candidate:jmdict:1591990",
    "candidate:jmdict:2872109"
  ],
  "sourceReferenceIds": [
    "bunka-keigo-guidelines",
    "irodori-reference",
    "jmdict",
    "kotobank-reference",
    "nhk-world-easy-japanese",
    "original-editorial"
  ],
  "sourceEditorialPass": {
    "completedAt": "2026-09-30T10:30:00Z",
    "reviewer": "Arena.ai Koto source-backed editorial pass",
    "reviewerType": "ai-editorial",
    "checks": [
      "All 32 previously unreviewed priority-route candidates were checked individually against their complete JMdict records.",
      "Twenty-nine candidates passed family assignment; three received explicit non-publication outcomes with record-specific reasons.",
      "Family boundaries were checked against all existing packs, decisions, and the review-policy inclusion tests.",
      "Japanese dictionary, Japan Foundation, NHK, or Agency for Cultural Affairs references were checked where applicable.",
      "Koto explanations, warnings, dialogues, translations, comparisons, and examples were written independently.",
      "Three existing families were re-opened for new variants and all of their learner-facing fields were reviewed again."
    ]
  },
  "finalLanguagePass": {
    "completedAt": "2026-09-30T12:00:00Z",
    "reviewer": "Arena.ai Koto Japanese editorial review",
    "reviewerType": "ai-editorial",
    "separateFromSourceEditorial": true,
    "checks": [
      "Japanese forms, readings, punctuation, and every device-TTS line were re-read independently.",
      "Meanings, register, hierarchy, politeness, hostility, ambiguity, rarity, and context dependence were checked.",
      "Examples and patterns were checked for naturalness and safe substitution rather than inferred from triage scores.",
      "The priority route was confirmed complete only after assignments and explicit non-publication outcomes were recorded.",
      "Pack contents, decision metadata, source disclosures, difficulty assignments, and publication gates were confirmed."
    ]
  },
  "result": "verified-and-packed"
}
