{
  "batchId": "editorial-batch:20260930-balanced-expansion-b",
  "familyIds": [
    "expression:decline-fuss",
    "expression:formal-written-directive",
    "expression:lucky-break",
    "expression:say-not-allowed",
    "expression:make-discussion-easier",
    "expression:gratefully-fortunate",
    "expression:formally-regrettably",
    "expression:take-under-wing",
    "expression:keep-within-attention",
    "expression:thank-regular-customer",
    "expression:express-regret-evaluation",
    "expression:gratitude-beyond-words",
    "expression:fortunately-relief",
    "expression:formal-take-care",
    "expression:formal-caution",
    "expression:use-this-opportunity",
    "expression:announce-wait-is-over",
    "expression:say-easy-favor",
    "expression:say-no-end",
    "expression:casual-permission-reassurance",
    "expression:invite-to-come",
    "expression:ask-to-be-left-alone",
    "expression:state-obligation",
    "expression:ask-degree-or-duration",
    "expression:express-means-or-cause",
    "expression:describe-experience-or-occasional-event",
    "expression:state-strong-duty",
    "expression:polite-therefore",
    "expression:softened-polite-question",
    "expression:make-probable-prediction",
    "expression:give-practical-advice",
    "expression:reject-as-impossible",
    "expression:exclaim-what-a",
    "expression:in-own-way",
    "expression:say-impossible-without",
    "expression:contrast-despite-state",
    "expression:say-if-anything",
    "expression:deny-general-conclusion",
    "expression:infer-so-that-means",
    "expression:express-unbearable-degree",
    "expression:seek-forceful-agreement",
    "expression:state-decided-result",
    "expression:state-personal-decision",
    "expression:make-conscious-habit",
    "expression:come-to-new-state",
    "expression:eventually-sometime",
    "expression:while-things-went-on",
    "expression:after-various-events",
    "expression:say-beyond-remedy",
    "expression:say-do-not-care",
    "expression:no-matter-what",
    "expression:set-topic-aside",
    "expression:remark-even-so",
    "expression:recall-speaking-of-which",
    "expression:accept-unavoidable",
    "expression:up-to-now",
    "expression:from-now-on",
    "expression:in-no-time",
    "expression:needless-to-say",
    "expression:sum-up-in-short",
    "expression:on-reflection",
    "expression:without-realizing",
    "expression:perhaps-maybe",
    "expression:manage-somehow",
    "expression:to-what-extent",
    "expression:refer-to-this-kind",
    "expression:the-thing-itself",
    "expression:surprisingly-degree",
    "expression:beyond-measure",
    "expression:judging-by-appearance",
    "expression:as-you-know",
    "expression:prior-to-event",
    "expression:still-unchanged",
    "expression:financially-strapped",
    "expression:make-lose-face",
    "expression:put-in-appearance",
    "expression:state-no-doubt",
    "expression:unmistakably-genuine",
    "expression:look-through-material",
    "expression:nothing-to-fault",
    "expression:probably-imagination",
    "expression:notice-or-realize",
    "expression:ask-every-detail",
    "expression:desperate-last-resort",
    "expression:play-it-safe",
    "expression:refreshing-respite",
    "expression:time-is-money",
    "expression:disregard-later-consequences",
    "expression:moderation-for-health",
    "expression:treat-as-honored-guest",
    "expression:do-by-own-hand",
    "expression:effort-paid-off",
    "expression:beyond-description",
    "expression:wake-or-come-to-senses",
    "expression:say-not-useful",
    "expression:well-connected",
    "expression:obtain-come-into-possession",
    "expression:just-in-case",
    "expression:what-is-more",
    "expression:two-benefits-one-action"
  ],
  "candidateIds": [
    "candidate:jmdict:1001900",
    "candidate:jmdict:2842483",
    "candidate:jmdict:1894260",
    "candidate:jmdict:1612750",
    "candidate:jmdict:2847320",
    "candidate:jmdict:2842007",
    "candidate:jmdict:2761370",
    "candidate:jmdict:2750430",
    "candidate:jmdict:2789690",
    "candidate:jmdict:2132990",
    "candidate:jmdict:2847930",
    "candidate:jmdict:2845713",
    "candidate:jmdict:2840784",
    "candidate:jmdict:2810680",
    "candidate:jmdict:2850261",
    "candidate:jmdict:2815470",
    "candidate:jmdict:1002360",
    "candidate:jmdict:2076340",
    "candidate:jmdict:1383810",
    "candidate:jmdict:2863159",
    "candidate:jmdict:1270400",
    "candidate:jmdict:2098350",
    "candidate:jmdict:2020700",
    "candidate:jmdict:2020705",
    "candidate:jmdict:2098150",
    "candidate:jmdict:2142120",
    "candidate:jmdict:1632350",
    "candidate:jmdict:2394660",
    "candidate:jmdict:1009250",
    "candidate:jmdict:2068080",
    "candidate:jmdict:1004600",
    "candidate:jmdict:1313590",
    "candidate:jmdict:1004540",
    "candidate:jmdict:1006200",
    "candidate:jmdict:2871535",
    "candidate:jmdict:2825978",
    "candidate:jmdict:1008420",
    "candidate:jmdict:1928670",
    "candidate:jmdict:2160680",
    "candidate:jmdict:2037230",
    "candidate:jmdict:1188450",
    "candidate:jmdict:2038230",
    "candidate:jmdict:2134700",
    "candidate:jmdict:2135520",
    "candidate:jmdict:2136160",
    "candidate:jmdict:2136710",
    "candidate:jmdict:2857085",
    "candidate:jmdict:1211340",
    "candidate:jmdict:2819990",
    "candidate:jmdict:1004590",
    "candidate:jmdict:2215340",
    "candidate:jmdict:1013120",
    "candidate:jmdict:1013130",
    "candidate:jmdict:1006930",
    "candidate:jmdict:2197170",
    "candidate:jmdict:2788160",
    "candidate:jmdict:2258710",
    "candidate:jmdict:2134860",
    "candidate:jmdict:2083140",
    "candidate:jmdict:1466950",
    "candidate:jmdict:2089620",
    "candidate:jmdict:2008730",
    "candidate:jmdict:1982210",
    "candidate:jmdict:1305510",
    "candidate:jmdict:1305420",
    "candidate:jmdict:1004820",
    "candidate:jmdict:1004790",
    "candidate:jmdict:2208410",
    "candidate:jmdict:1264350",
    "candidate:jmdict:1546620",
    "candidate:jmdict:1281010",
    "candidate:jmdict:2398050",
    "candidate:jmdict:1012510",
    "candidate:jmdict:1188420",
    "candidate:jmdict:2027100",
    "candidate:jmdict:2202790",
    "candidate:jmdict:2008640",
    "candidate:jmdict:2085090",
    "candidate:jmdict:1612700",
    "candidate:jmdict:2827571",
    "candidate:jmdict:1252080",
    "candidate:jmdict:1715710",
    "candidate:jmdict:2793090",
    "candidate:jmdict:2845662",
    "candidate:jmdict:1155660",
    "candidate:jmdict:1193670",
    "candidate:jmdict:1217770",
    "candidate:jmdict:2101420",
    "candidate:jmdict:2006640",
    "candidate:jmdict:1610740",
    "candidate:jmdict:2088270",
    "candidate:jmdict:1535250",
    "candidate:jmdict:1612020",
    "candidate:jmdict:1221750",
    "candidate:jmdict:1591050",
    "candidate:jmdict:1290060",
    "candidate:jmdict:1244600",
    "candidate:jmdict:2069080",
    "candidate:jmdict:2168420",
    "candidate:jmdict:2140350",
    "candidate:jmdict:2417270",
    "candidate:jmdict:2419580",
    "candidate:jmdict:2125680",
    "candidate:jmdict:2803280",
    "candidate:jmdict:2868981",
    "candidate:jmdict:2214880",
    "candidate:jmdict:2143090",
    "candidate:jmdict:1912970",
    "candidate:jmdict:2139970",
    "candidate:jmdict:1327220",
    "candidate:jmdict:1469350",
    "candidate:jmdict:1001480",
    "candidate:jmdict:1164160"
  ],
  "sourceReferenceIds": [
    "jmdict",
    "kotobank-reference",
    "original-editorial"
  ],
  "sourceEditorialPass": {
    "completedAt": "2026-09-30T14:00:00Z",
    "reviewer": "Arena.ai Koto source-backed editorial pass",
    "reviewerType": "ai-editorial",
    "checks": [
      "Each selected JMdict identity, current sense, reading, register flag, and triage risk field was checked.",
      "Related surface forms were merged into reusable families instead of being counted as separate families.",
      "All one hundred family boundaries were checked against the existing sixty production families.",
      "Japanese-language dictionary searches were used as independent terminology and family-boundary checks without copying source prose.",
      "Usage boundaries, social warnings, responses, follow-ups, dialogue, comparisons, and constrained frames were authored for Koto.",
      "Difficulty was assigned from communicative burden, grammar, opacity, register, and social risk rather than automated score."
    ]
  },
  "finalLanguagePass": {
    "completedAt": "2026-09-30T16:30:00Z",
    "reviewer": "Arena.ai Koto Japanese editorial review",
    "reviewerType": "ai-editorial",
    "separateFromSourceEditorial": true,
    "checks": [
      "Every Japanese example and device-TTS reading was re-read after pack generation.",
      "Contextual English meanings were checked against the specific Japanese example rather than treated as word-for-word glosses.",
      "Register, relationship guidance, avoid warnings, and face-threatening or polysemous uses were checked again.",
      "Responses and follow-ups were checked as complete speakable lines, while substitution slots remain only in pattern fields.",
      "All eight publication gates, candidate assignments, pack counts, checksums, and manifest totals were confirmed.",
      "AI reviewer identity is disclosed throughout; no human Japanese sign-off is claimed."
    ]
  },
  "result": "verified-and-packed"
}
