{
  "batchId": "editorial-batch:20260930-balanced-expansion",
  "familyIds": [
    "expression:leave-and-return",
    "expression:wish-recovery",
    "expression:say-see-you",
    "expression:reconnect-after-time",
    "expression:call-at-a-door",
    "expression:excuse-home-intrusion",
    "expression:invite-with-masenka",
    "expression:offer-with-mashouka",
    "expression:respond-souka",
    "expression:soft-refusal-chotto",
    "expression:soften-request-otesuu",
    "expression:how-to-put-it",
    "expression:wait-and-see",
    "expression:request-understanding",
    "expression:appreciated-if-saiwai",
    "expression:not-necessarily-wakedehanai",
    "expression:express-possibility-kamoshirenai",
    "expression:too-late-atonomatsuri",
    "expression:world-of-difference-undeinosa",
    "expression:set-aside-own-faults",
    "expression:apologize-or-get-attention",
    "expression:excuse-formal-departure",
    "expression:express-thanks",
    "expression:make-request-onegaishimasu",
    "expression:say-no-problem"
  ],
  "candidateIds": [
    "candidate:jmdict:2020140",
    "candidate:jmdict:2172760",
    "candidate:jmdict:1002390",
    "candidate:jmdict:2135480",
    "candidate:jmdict:2222180",
    "candidate:jmdict:1270690",
    "candidate:jmdict:1002050",
    "candidate:jmdict:2210270",
    "candidate:jmdict:2210710",
    "candidate:jmdict:2093030",
    "candidate:jmdict:2425480",
    "candidate:jmdict:1163940",
    "candidate:jmdict:2830449",
    "candidate:jmdict:2838528",
    "candidate:jmdict:2853389",
    "candidate:jmdict:2860737",
    "candidate:jmdict:2871489",
    "candidate:jmdict:2057560",
    "candidate:jmdict:2234750",
    "candidate:jmdict:1002970",
    "candidate:jmdict:1002975",
    "candidate:jmdict:2100710",
    "candidate:jmdict:1678830",
    "candidate:jmdict:1173240",
    "candidate:jmdict:2086780",
    "candidate:jmdict:1295060",
    "candidate:jmdict:1270680",
    "candidate:jmdict:1612030",
    "candidate:jmdict:1612040",
    "candidate:jmdict:1985560",
    "candidate:jmdict:2083600",
    "candidate:jmdict:2276200",
    "candidate:jmdict:1320240",
    "candidate:jmdict:1320230",
    "candidate:jmdict:1002280",
    "candidate:jmdict:2747000",
    "candidate:jmdict:1541040",
    "candidate:jmdict:1612720",
    "candidate:jmdict:2845468",
    "candidate:jmdict:2838980",
    "candidate:jmdict:1001720",
    "candidate:jmdict:1001730",
    "candidate:jmdict:2848696",
    "candidate:jmdict:1279670",
    "candidate:jmdict:1866610"
  ],
  "sourceReferenceIds": [
    "irodori-reference",
    "jmdict",
    "jpf-reference",
    "kotobank-reference",
    "nhk-world-easy-japanese",
    "original-editorial"
  ],
  "sourceEditorialPass": {
    "completedAt": "2026-09-30T08:00:00Z",
    "reviewer": "Arena.ai Koto source-backed editorial pass",
    "reviewerType": "ai-editorial",
    "checks": [
      "Each candidate identity, current JMdict sense, reading, and usage flag was checked record by record.",
      "Family boundaries were checked against all previously verified families and candidate assignments.",
      "Japan Foundation, NHK, or Japanese dictionary references were checked for communicative use, grammar, register, or idiomatic meaning.",
      "Koto usage, relationship, avoid, dialogue, pattern, and comparison content was authored independently without copying source prose.",
      "The batch was intentionally balanced across Koto Difficulty 1 through 5 and across greetings, interaction, requests, grammar, discourse, and idioms.",
      "Canonical Vocabulary candidate links were retained.",
      "Five existing families were re-opened, expanded with eleven reviewed register or function variants, and re-verified as revision 2 records."
    ]
  },
  "finalLanguagePass": {
    "completedAt": "2026-09-30T09:15:00Z",
    "reviewer": "Arena.ai Koto Japanese editorial review",
    "reviewerType": "ai-editorial",
    "separateFromSourceEditorial": true,
    "checks": [
      "Japanese naturalness, readings, punctuation, and directly speakable device-TTS lines were re-read.",
      "Meanings were checked for context dependence, ambiguity, figurative force, and over-translation.",
      "Register, relationship, social-use warnings, and potentially face-threatening expressions were checked.",
      "Dialogue, responses, follow-ups, and substitution examples were checked independently from triage ranking.",
      "Productive templates were kept in reviewed pattern fields while device-TTS fields contain complete speakable Japanese.",
      "All final-publication gates, pack counts, source disclosures, and candidate decisions were confirmed."
    ]
  },
  "result": "verified-and-packed"
}
